H-A331-P1	in cases where successive sales are made with respect to the same immovable properties the order of priority of the statutory liens for the sale of the immovable properties among sellers shall follow the chronological order of the sales
H-A332-P0	if there are two or more holders of statutory liens with the same priority with respect to the same object the holders of statutory liens shall be paid in proportion to the amounts of their claims
H-A333-P0	statutory liens may not be exercised with respect to the movables that are the subject matter of the same after the obligors have delivered those movables to third-party acquirers
H-A334-P0	in cases where there is conflict between a statutory lien and a pledge of movables the pledgee of such movables shall have the same rights as those of the holder of a statutory lien of the first rank under article 330
H-A335-P0	the provisions of the preceding three paragraphs shall not apply to cases where the proceeds of immovable properties are distributed prior to the proceeds of assets other than immovable properties or the proceeds of immovable properties that is the subject matter of a special security are distributed prior to the proceeds of other immovable properties
H-A335-P1	holders of general statutory liens cannot be paid out of immovable properties unless they are first paid out of property other than immovable properties and a claim that is not satisfied remains
H-A335-P2	with respect to immovable properties holders of general statutory liens must first be paid out of those that are not the subject matters of special security
H-A335-P3	if holders of general statutory liens fail to participate in distributions in accordance with the provisions of the preceding two paragraphs they cannot exercise their statutory liens against registered third parties with respect to amounts that would have been paid to them if they had participated in the distribution
H-A336-P0	general statutory liens may be asserted against obligees without special security even if the liens are not registered with respect to the relevant immovable property provided however that this shall not apply to registered third parties
H-A337-P0	in order to preserve the effectiveness of statutory liens for preservation of immovable properties registration must be carried out immediately after the completion of the act of preservation
H-A338-P0	the amount of increase in value of immovable properties that resulted from construction work must be evaluated by an appraiser selected by the court at the time of the participation in the distribution
H-A338-P1	in order to preserve the effectiveness of statutory liens for construction work for immovable properties the budgeted expenses of the construction work must be registered prior to the commencement of the same in such cases if the expenses of the construction work exceed the budgeted amount a statutory lien shall not exist with respect to the amount in excess of the same
H-A339-P0	statutory liens registered in accordance with the provisions of the preceding two articles may be exercised prior to mortgages
H-A340-P0	in order to preserve the effectiveness of statutory liens for the sale of immovable properties a statement to the effect that the price of the immovable properties or interest on the same has not been paid must be registered simultaneously with the execution of the sales contract
H-A341-P0	in addition to the provisions of this section the provisions regarding mortgages shall apply mutatis mutandis to the effects of statutory liens to the extent that application is not inconsistent with the nature of the same
H-A342-P0	pledgees shall have the right to possess thing received from obligors or third parties as security for their claims and to have their own claims paid prior to other obligees out of that thing
H-A343-P0	pledges cannot be created over a thing that cannot be assigned to others
H-A344-P0	the creation of a pledge shall take effect by delivering the subject matter of the same to the obligee
H-A345-P0	a pledgee may not allow a pledgor to possess the thing pledged on behalf of the pledgee
H-A346-P0	pledges shall secure the principal interest penalties expenses of executing the pledge expense of preserving the thing pledged and the compensation of damage arising from failure to perform obligations or latent defects in the thing pledged provided however that this shall not apply if the act establishing the pledge provides otherwise
H-A347-P0	pledgees may retain the thing pledged until the claims provided for in the preceding article are satisfied provided however that this right cannot be asserted against obligees who have priority over the pledgees
H-A348-P0	pledgees may sub-pledge the thing pledged within the duration of their rights upon their own responsibility in such cases the pledgees shall be responsible for any loss arising from the -pledge even if the same is caused by force majeure
H-A349-P0	pledgors cannot either by the acts establishing pledges or by contracts made prior to the due dates for performance of their obligations allow pledgees to acquire ownership of the thing pledged as payment nor promise to allow pledgees to dispose of it in any manner other than is prescribed by law
H-A350-P0	the provisions of articles 296 through 300 and those of article 304 shall apply mutatis mutandis to pledges
H-A351-P0	if persons who created pledges to secure the obligations of others have performed those obligations or have lost ownership of the thing pledged due to the execution of the pledges they shall have the right to obtain reimbursement from the obligors in accordance with the provisions regarding guarantee obligations
H-A352-P0	pledgees of movables cannot assert their pledges against third parties unless they are in continuous possession of the thing pledged
H-A353-P0	pledgees of movables may if the pledged thing is usurped recover the same solely by bringing actions for recovery of possession
H-A354-P0	if claims of pledgees of movables are not performed they may limited to cases where there are reasonable grounds demand from a court immediate appropriation of the thing pledged to the performance of the claims in accordance with the evaluation of an appraiser in such cases the pledgees of movables must notify the obligors in advance of the demand
H-A355-P0	if more than one pledge is created with respect to the same movables the order of priority of those pledges shall follow the chronological order of their creation
H-A356-P0	pledgees of immovable property may use and receive the profits from the immovable property that is the subject matter of a pledge in accordance with the method of its use
H-A357-P0	pledgees of immovable properties shall pay the expenses of management and otherwise bear burdens in relation to the immovable properties
H-A358-P0	pledgees of immovable properties cannot demand interest on their claims
H-A359-P0	the provisions of the preceding three articles shall not apply in cases where the acts establishing pledges provide otherwise or execution against profits derived from the immovable properties as collateral hereinafter referring to the execution against profits from secured immovable properties provided for in item ii of article 180 of the civil execution act law no 4 of 1979 has been commenced
H-A360-P0	the duration of pledges of immovable properties cannot exceed ten years even if a longer period is provided for in the act establishing the pledge the duration of the same shall be ten years
H-A360-P1	the creation of pledges may be renewed provided however that the duration of the same cannot exceed ten years from the time of the renewal
H-A361-P0	in addition to the provisions of this section the provisions of the next chapter shall apply mutatis mutandis to pledges of immovable properties to the extent that application is not inconsistent with the nature of the same
H-A362-P0	in addition to the provisions of this section the provisions of the preceding three sections general provisions pledges of movables and pledges of immovable properties shall apply mutatis mutandis to pledges under the preceding paragraph to the extent that application is not inconsistent with the nature of the same
H-A362-P1	pledges may have property rights for their subject matters
H-A363-P0	when a pledges is to be created over a claim and the delivery of an instrument evidencing it is required for its assignment the creation of the pledge shall take effect by the delivery of such instrument
H-A364-P0	if a pledge is created over a nominative claim that pledge cannot be asserted against third parties including third party obligors unless notice of the creation of the pledge is given to third party obligors in accordance with the provisions of article 467 or unless the third party obligors acknowledge the same
H-A365-P0	if a pledge is created over debts payable to order that pledge cannot be asserted against third parties unless the creation of the pledge is endorsed on the instrument of the same
H-A366-P0	if the due date of the pledged claim under the preceding paragraph arrives prior to the due date of the claim of the pledgee the pledgee may have the third party obligor deposit that amount to be paid to the pledgee in such cases the pledge shall exist over the amount so deposited
H-A366-P1	a pledgee may directly collect the claim that is the subject matter of the pledge
H-A366-P2	if the subject matter of the pledged claim is not monies the pledgee shall have the pledge over the thing received as performance of the obligation
H-A366-P3	if monies are the subject matter of a pledged claim the pledgee may collect the same to the extent of the portion that corresponds to the amount of the pledgee's own claim
H-A367-P0	deleted
H-A368-P0	deleted
H-A369-P0	superficies and emphyteusis can be the subject matter of a mortgage in such cases the provisions of this chapter shall apply mutatis mutandis
H-A369-P1	a mortgagee shall have the right to receive the performance of his her claim prior to other obligees out of the immovable properties that the obligor or a third party provided to secure the obligation without transferring possession
H-A370-P0	a mortgage shall extend to the things that is an integral part of immovable properties that is the subject matter of the mortgage hereinafter referred to as "mortgaged immovable properties" except for buildings on the mortgaged land provided however that this shall not apply in cases where the act establishing the mortgage provides otherwise or the obligee can rescind the act of the obligor in accordance with the provisions of article 424
H-A371-P0	if there is a default with respect to a claim secured by a mortgage the mortgage shall extend to the fruits of the mortgaged immovable properties derived after the default
H-A372-P0	the provisions of article 296 article 304 and article 351 shall apply mutatis mutandis to mortgages
H-A373-P0	if more than one mortgage is created with respect to the same immovable properties the order of priority of those mortgages shall follow the chronological order of their registration
H-A374-P0	the changes in order under the preceding paragraph shall not take effect unless registered
H-A374-P1	the order of priority of mortgages may be changed with the agreement of all mortgagees provided however that if there are interested persons the consent of the same must be obtained
H-A375-P0	if mortgagees have rights to demand periodic payments including interest they may exercise their mortgages solely with respect to payments that have fallen due in the most recent two years provided however that if special registration is effected with respect to prior periodical payments that have fallen due the mortgagees shall not be precluded from exercising their mortgages as from the time of that registration
H-A375-P1	in cases where mortgagees have rights to demand the compensation for damages resulting from defaults in obligations the provisions of the preceding paragraph shall apply mutatis mutandis to the damages of the most recent two years provided however that the aggregate period including the interest and other periodical payments may not exceed two years
H-A376-P0	a mortgagee may apply his her mortgage to secure other claims or assign or waive his her mortgage or its order of priority for the benefit of other obligees of the same obligor
H-A376-P1	in the cases provided for in the preceding paragraph if a mortgagee disposes of his her mortgage for the benefit of two or more persons the order of priority of the rights of persons who receive the benefit of that disposition shall follow the chronological order noted in the registration of the mortgage
H-A377-P0	in the cases in the preceding article in accordance with the provisions of article 467 mortgagees cannot assert the disposition of mortgages against principal obligors guarantors mortgagors or their respective successors unless the disposition is notified to the primary obligors or the principal obligors acknowledge that disposition
H-A377-P1	if the principal obligors have received the notice or given acknowledgement under the provisions of the preceding paragraph performance effected without the approval of the persons who receive the benefit of the disposition of mortgages cannot be asserted against those beneficiaries
H-A378-P0	if a third party who purchases the ownership or superficies of mortgaged immovable properties pay the price of the same to the relevant mortgagee at the request of the mortgagee the mortgage shall be extinguished for the benefit of that third party
H-A379-P0	a third party acquirer of mortgaged immovable properties may make a claim for the extinction of a mortgage as prescribed in article 383
H-A380-P0	no primary obligor guarantor or successor of the same may make a claim for the extinction of a mortgage
H-A381-P0	a third party acquirer of mortgaged immovable properties that is subject to a condition precedent may not make a claim for the extinction of a mortgage whilst whether or not the condition precedent is satisfied is still undetermined
H-A382-P0	a third party acquirer of mortgaged immovable properties must make a claim for the extinction of a mortgage before attachment by auction as a result of the execution of the mortgage takes effect
H-A383-P0	if a third party acquirer of mortgaged immovable properties intends to make a claim for the extinction of a mortgage he she must send the documents listed below to each registered obligee i a document that specifies the cause and date of the acquisition the name and address of the assignor and the acquirer the nature location and price of the mortgaged immovable properties and burdens of the acquirer ii a certificate of registered matters regarding the mortgaged immovable properties limited to certificates certifying all registered matters currently in effect and iii a document to the effect that if the obligee does not file a petition for auction by executing the mortgage within two months the third party acquirer of the immovable properties will pay or deposit the price provided for in item i or an amount specifically designated in accordance with the order of priority of claims
H-A384-P0	in the cases listed below obligees who have received the documents listed in each item of the preceding article shall be deemed to have approved the price or amount that the third party acquirer of mortgaged immovable properties has offered as stated in the document listed in item iii of that article i if the obligee does not file a petition for auction by executing the mortgage within two months after receipt of the documents listed in each item of the preceding article ii if the obligee withdraws a petition under the preceding item iii if a ruling dismissing a petition under item i has become final and binding or iv if a ruling rescinding auction procedures based on a petition under item i excluding rulings under the provisions of paragraph 3 of article 63 or paragraph 3 of article 68-3 of the civil execution act applied mutatis mutandis under article 188 of the same act or under the provisions of paragraph 2 of article 183 of the same act in cases where the certified copy under item v paragraph 1 of the same article is provided has become final and binding
H-A385-P0	if an obligee who has received the documents listed in each item of article 383 files a petition under item i of the preceding article he she must give notice to such effect to the obligor and assignor of the mortgaged immovable properties within the period under that item
H-A386-P0	a mortgage shall be extinguished if all registered obligees approve the price or amount offered by the third party acquirer of the mortgaged immovable properties and the third party acquirer of the mortgaged immovable properties has paid or deposited the price or amount approved
H-A387-P0	for a mortgagee to give the consent under the preceding paragraph the approval of the persons who hold rights for which the mortgage is the object and other persons who will suffer detriment as a result of the consent of the mortgagee must be obtained
H-A387-P1	if all persons holding mortgages the registrations of which precede the registration of a lease give their consent and such consents are registered the lease so registered can be asserted against those mortgagees who gave their consent
H-A388-P0	in cases where land and a building on the land belong to the same owner if a mortgage is created with respect to that land or building and the execution of that mortgage results in the creation of different owners it shall be deemed that a superficies has been created with respect to that building in such cases the rent shall be fixed by the court at the request of the parties
H-A389-P0	the provisions of the preceding paragraph shall not apply in cases where the owner of that building has rights with respect to the possession of the mortgaged land that can be asserted against the mortgagee
H-A389-P1	if a building is constructed on mortgaged land after the creation of a mortgage the mortgagee may auction the building together with the land provided however that his her right of priority may be exercised solely against the proceeds of the land
H-A390-P0	a third party acquirer of mortgaged immovable properties may be the purchaser at the auction of the same
H-A391-P0	if a third party acquirer of mortgaged immovable properties has incurred necessary or beneficial expenses with respect to the mortgaged immovable properties he she shall be entitled to obtain reimbursement of the same out of the proceeds of the mortgaged immovable properties prior to other obligees in accordance with the distinctions in article 196
H-A392-P0	in cases where an obligee holds mortgages on several immovable properties to secure the same claim if the proceeds of those immovable properties are to be distributed simultaneously the obligee shall divide the burden of the claim in proportion to the value of each immovable property
H-A392-P1	in cases where an obligee holds mortgages on several immovable properties to secure the same claim if the proceeds from a particular immovable property alone are to be distributed the mortgagee may receive the payment of his her entire claim out of those proceeds in such cases subordinated mortgagees may exercise their mortgages in subrogation of that mortgagee up to the amount that that mortgagee who receives payment would otherwise be entitled to receive from the proceeds of other immovable properties in accordance with the provisions of the preceding paragraph
H-A393-P0	a person who exercises a mortgage by way of subrogation under the provisions of the second sentence of paragraph 2 of the preceding article may note his her subrogation in the registration of that mortgage
H-A394-P0	the provisions of the preceding paragraph shall not apply to cases where the proceeds of other assets are to be distributed prior to the proceeds of the mortgaged immovable properties in such cases each other obligee may demand that the amount to be distributed to the mortgagee be deposited in order to have the mortgagee receive payment under the provisions of that paragraph
H-A394-P1	a mortgagee may receive payment from assets other than the mortgaged immovable properties limited to the extent of the portion of his her claim not paid from the proceeds of that mortgaged immovable properties
H-A395-P0	the provisions of the preceding paragraph shall not apply in cases where the purchaser issues a notice to the mortgaged building user demanding payment of consideration for a period of one month or more with respect to the use of the building in that paragraph that has occurred after the time of purchase by the purchaser establishing a reasonable period and no payment is made within that reasonable period
H-A395-P1	any person who uses or receives profits from a building subject to a mortgage by virture of a lease that cannot be asserted against the mortgagee and who is listed as follows in the following paragraph referred to as "mortgaged building user" shall not be required to deliver that building to the purchaser thereof until six months have elapsed from the time when the purchaser purchased that building at auction i a person who has been using or receiving profits from the building since prior to the commencement of auction procedures or ii a person who is using or receiving profits from the building by virtue of a lease given after the commencement of auction procedures by the administrator of compulsory administration or execution against profits from secured immovable properties
H-A396-P0	no mortgage shall be extinguished by prescription in relation to obligors and mortgagors unless it is extinguished simultaneously with the claim the mortgage secures
H-A397-P0	if a person who is neither an obligor nor a mortgagor has possessed the mortgaged immovable properties in complete conformity with the requirements for acquisitive prescription the mortgage shall be extinguished thereby
H-A398-P0	even if a holder of superficies or a emphyteuta who created mortgage on his her superficies or emphyteusis renounces his her rights the renouncement cannot be asserted against the mortgagee
H-A398-10-P0	the provisions of paragraphs 3 through 5 of the preceding article shall apply mutatis mutandis to cases under the preceding two paragraphs
H-A398-10-P1	if before the principal is fixed a split in which the relevant revolving mortgagee is the company to be split is effected the revolving mortgage shall secure the claims that exist at the time of the split and shall otherwise secure claims acquired after the split by the split company and the company incorporated by the split or claims acquired after the split by the company that succeeded to some or all of the rights and obligations of the split company regarding its business
H-A398-10-P2	if before the principal is fixed a split in which the relevant obligor is the company to be split is effected the revolving mortgage shall secure the obligations that exist at the time of the split and shall otherwise secure obligations that are assumed after the split by the split company and the company incorporated by the split or claims acquired after the split by the company that assumed some or all of the rights and obligations of the split company regarding its business
H-A398-11-P0	the provisions of paragraph 2 of article 377 shall not apply to payments made before the principal is fixed in the cases provided for in the proviso to the preceding paragraph
H-A398-11-P1	before the principal is fixed a revolving mortgagee cannot dispose of a revolving mortgage under the provisions of paragraph 1 of article 376 provided however that he she shall not be precluded from applying that revolving mortgage to secure other claims
H-A398-12-P0	before the principal is fixed a revolving mortgagee may assign a revolving mortgage with the approval of the revolving mortgagor
H-A398-12-P1	a revolving mortgagee may divide his her revolving mortgage into two revolving mortgages and assign either of the same in accordance with the provisions of the preceding paragraph in such cases the rights for which that revolving mortgage is the subject matter shall be extinguished with respect to the revolving mortgage that was assigned
H-A398-12-P2	in order to effect an assignment under the provisions of the preceding paragraph the approval of the person who holds the rights for which that revolving mortgage is the subject matter must be obtained
H-A398-13-P0	before the principal is fixed a revolving mortgagee may with the approval of the revolving mortgagor effect a partial assignment of the revolving mortgage hereinafter in this section referring to assignments of revolving mortgages that the assignor effects without dividing the revolving mortgage in order to co-own the same with the assignee
H-A398-14-P0	co-owners of a revolving mortgage shall be paid in proportion to the amount of their respective claims provided however that if before the principal is fixed a proportion other than the above is agreed or if it is agreed that a certain person should be paid prior to the others that agreement shall prevail
H-A398-14-P1	a co-owner in a revolving mortgage may with the consent of the other co-owners assign rights of the same in accordance with the provisions of paragraph 1 of article 398-12
H-A398-15-P0	if a revolving mortgagee who has accepted an assignment or waiver of the order of priority of a mortgage has assigned or partially assigned his her revolving mortgage the assignee shall receive the benefit of the assignment or waiver of that order of priority
