H26-11-A	the order of priority of mortgages may be changed only with the agreement of all mortgagees provided however the changes may not be asserted against third parties unless registered
H26-10-3	a library of a university a has a book "p" and a professor b borrowes the same and uses his her office in the same campus in the case where b left "p" in a train on the way home and f found and possesses the same b may claim for the restoration of "p" by bringing an action for recovery of possession against f
H21-9-1	after person a who is the owner and depositor of a moveable orders person b who is the depositary to thenceforward possess the moveable on behalf of third party person c and person c consented thereto person c shall acquire the possessory right for the moveable
H24-15-3	a primary obligor may not make a claim for the extinction of a mortgage however a jointly and severally liable guarantor with respect to the obligation may make that claim
H25-16-4	a mortgage shall extend to the buildings on the mortgaged land as long as the mortgage provides otherwise
H23-12-U	a person who is being exercised rights of retention can demand that the right be extinguished by tendering reasonable security but a person who is being exercised rights of defense for simultaneous performance cannot demand that the right be extinguished by tendering reasonable security
H20-15-A	a pledgee must possess a pledged thing with the care of a good manager
H18-15-2	if the principal is fixed the revolving mortgage will be treated the same as an ordinary mortgage and thus interests or damages of secured claims secured by the revolving mortgage shall be limited to the amount of the last two years
H19-16-4	holders of superficies created upon mortgaged real estates may not make a claim for the extinction of the mortgage
H20-12-4	a right of retention and a pledge do not expire by just satisfying his her a portion of the secured claim due to their indivisibility but for a right of retention the obligor may demand the expiration of the right by offering appropriate collateral
H26-12-I	if a tree or bamboo branch from neighboring land crosses a boundary line the landowner may sever that branch and claim reimbursement of those costs from the owner of the neighboring land
H19-10-O	a landowner that leased his her land and delivered it to a lessee not only may demand the return of such land by way of possessory actions but also may demand the return of the land by way of actions on title based on landownership in cases where the land was usurped by a third party
H21-9-4	if person a who is the owner of a moveable and possesses it him herself enters into a sale contract with person b and simultaneously enters into a loan contract for use with person b as the use lender and person a as the lease borrower then person b acquires the possessory right for the moveable due to the manifestation of intention of person a to the effect that he she will thenceforward possess the thing on behalf of person b
H22-11-2	pledges on movable property do not take effect if there is no delivery and thus for that movable multiple pledges cannot be created
H22-11-5	if the possession of the pledgee of a pledge on movable property is stolen by a third party the pledgee can demand the return based on the pledge
H26-11-G	in a sale the ownership of the subject matter transfers at the time of formation of the contract in principle but the relevant parties may stipulate that the ownership is transferred at other time
H24-16-5	a revolving mortgagee after the principal is fixed may exercise his her revolving mortgage up to the maximum amount with respect to all fixed payments of principal as well as perioical payments including interest and compensation for damages resulting from failure to perform obligations that have fallen due in the most recent two years
H21-12-2	a right of retention is not established when a secured claim has not yet fallen due
H21-13-A	the statutory lien of a lessor of a building shall exist with movables furnished to that building by the lessee
H27-11-U	in cases where dominant land is co-owned by more than one person one of the co-owners of dominant land may renounce his her own share a servitude that exists on behalf of the land
H19-16-3	if a building existed on a mortgaged land at the time it was mortgaged even if the owner of that building did not have the right to possess the land which may be asserted against the mortgagee the mortgagee may not auction the building together with the land
H18-9-1	usufructuary rights are only established for real estate
H24-10-1	a bought the movable "a" from b and a aquired possessory right by constructive transfer however b is forcibly dispossessed the movable "a" by c in this case a may claim for the restoration of the movable "a" against c not only based on the ownership but also by bringing an action for recovery of possession
H25-14-A	a holder of statutory lien for the sales of the immovable property who has registration of such statutory lien may exercise statutory lien prior to mortgages regardless of the chronological order of the registraiton
H27-11-O	a servitude may not be established with respect to the land not neighboring a deminant land as a servient land
H25-13-5	if the amount of the obligations actually in existence after the principal is fixed exceeds the maximum amount of the revolving mortgage a person who created his her revolving mortgage to secure obligations of others may request the extinction of that revolving mortgage by tendering or depositing an amount equivalent to that maximum amount
H26-13-G	if the contractor refuses to deliver of the subject matter of work performed based on the right of retention that the secured claim is the claim of remuneration against the party ordering the work the running of extinctive prescription of the claim of remuneration shall not be preclude
H24-12-1	in cases where a have created the b 's supercify over a's land and registered such fact the supercify shall be extinguished if b acquires the ownership of a's land even if the supecify was the object of the mortgage of a third party
H23-10-3	a possessor is presumed to possess in good faith peacefully and in public but is not presumed to have intention to own
H24-16-4	if an inheritance of a revolving mortgagee commences before the principal is fixed the principal secured by a revolvoing mortgage shall be fixed at the time of the commencement of the inheritance unless there is the agreement between the heirs and the revolving mortgagor to success the revolving mortgage
H23-10-4	in cases where it is assumed due to the nature of the title that a possessor does not have the intention to own if the possessor commences possession under a new title with an intention to own from that time the nature of the possessor's possession changes with the intention to own
H23-13-E	in cases where a nominative claim where the obligee is an individual is the subject matter of a pledge to assert the establishment of the pledge against a third party other than the obligator of the claim that is a subject matter of the pledge the notification or acknowledgement using an instrument bearing a fixed date is required
H21-13-I	an obligee that has a general statutory lien may exercise the statutory lien concerning money that the obligor has received in payment as compensation for that thing owned
H18-9-2	statutory real rights granted by way of security exist but statutory usufructuary rights do not exist
H19-8-A	x who purchased a real estate p from decedent a before the commencement of inheritance may assert his ownership of p against y without registration if y who is the obligee of a's sole heir b seized p in subrogation to b after b's inheritance registration of p
H19-11-5	in a case where a b and c co-own a land d who has inherited a's share from a may assert his her acquisition of a's share against b and c without completing the registration
H21-12-3	a holder of a right of retention may not accept priority performance from the subject matter but may accept priority performance from fruits that derived from the subject matter
H18-32-5	a seller that cancelled a movable sale contract on the basis of duress can demand return of the movable based on its ownership from the person who bought the movable from the buyer prior to the cancellation without knowledge or any negligence
H25-8-4	if one of the co-owners of land acquires a servitude by prescription the other co-owners shall also acquire the same
H26-14-I	in case where b holds the mortgage ranked first and c holds the mortgage ranked second with respect to a building belonging to aeven if b purchases the building from a the mortgage ranked first shall not be extinguished
H21-8-A	an agent may even acquire a possessory right but since the effect of possession by the agent belongs to the principle the agent him herself may not acquire an individual possessory right for the thing possessed
H21-10-5	in cases where person a who owns land l subdivides the land into land m which is surrounded by other land and has no access to public roads and land n which is not so then sells land m to person b person b has the right-of-way to reach public roads only regarding land n
H19-13-I	statutory liens for employer-employee relationships secure salaries paid regularly but do not secure retirement payments that should be paid when the employee retires
H19-13-O	in addition to the fixed principal revolving mortgages with a fixed principal shall secure up to the maximum amount with respect to the periodic payments including interest for those that have fallen due in the most recent two years
H25-14-U	statutory liens for employer-employee relationships shall exist with respect to salaries and other claims that arose under the employer-employee relationship between the obligor and his her employee
H26-14-G	if twenty years has elapsed from the time when it becomes possible to execute the mortgage a mortgagor may assert the extinction of the mortgage by prescription
H21-9-2	if person a who is the owner and lessor of a moveable enters into a sales contract with person b who received the transfer as a lessee then person a loses the possessory right for the moveable due to the manifestation of intention of person a and person b to the effect that the possessory right is transferred
H24-10-5	in cases where a bought the movable "a" which b had owned and deposited to the depositary if a orders the depositary to thenceforward possess it on behalf of a and such depositary consents thereto a shall acquire the possessory right
H21-13-O	a pledgee and a pledgor may not agree to the pledgee's acquisition of the thing pledged as performance for obligations even after the due dates for performance of his her obligations secured by the pledge
H27-11-A	if a person entitled to a servitude does not exercise a portion of his her rights only that portion shall be extinguished by prescription
H24-14-U	a mortgage may also be exercised against the claim for damage that the obligor is to receive as a result of the loss of the subject matter of the mortgage on the other hand a right of retention may not
H19-13-E	in addition to the principal of the secured claim mortgages that are not revolving mortgages shall secure periodic payments including interest only for those that have fallen due in the most recent two years
H26-10-1	a library of a university a has a book "p" and a professor b borrowes the same and uses his her office in the same campus in cases where a third party c steals and possesses "p" during b's absence to go abroad on business trip b may claim for the restoration of "p" by bringing an action for recovery of possession against c
H24-9-4	a claim may be the subject of another claim howver a claim may not be subject of a real right
H21-9-3	if person b who is the depositary and gets approval from person a who is the owner and depositor of a moveable entered into a deposit contract with third party person c for the moveable and transferred it then person b loses the possessory right for the moveable
H24-22-3	in cases where a mortgage is created with respect to b 's land to secure a 's claim against b after that other mortgage is created with repect to the same to secure c ' claim against b if a inherits from b by oneself the mortgage to secure a's claim shall be extinguished
H19-16-2	a registered lease may be asserted against the mortgagee who gave consent to the lease if the entire mortgagee who had registered their respective mortgage before the lease's registration gave consent to the lease
H26-36-I	in cases where a third party acquirer of mortgaged immovable properties has incurred ordinary necessary expenses with respect to the mortgaged immovable properties even if he she has acquired fruitshe she shall be entitled to obtain reimbursement of the same out of the proceeds of the mortgaged immovable properties prior to other obligees
H22-8-I	when a tree or bamboo branch from neighboring land cross a boundary line the person can remove the branch him or herself but cannot have the owner of that tree or bamboosever the branch
H21-12-1	a right of retention is not established if the obligee with a secured claim does not possess the subject matter and even if he she temporarily has possession the right shall not be established in cases where the possession commenced by means of a tortious act
H24-14-A	rights of retention is the right hold by a possessor of a thing belonging to another porson therefore in cases a holder a right of retention leases the thing retained to a third party a right of retention shall be extinguished even if he she obtains the consent of an owner
H24-10-4	a got the creation of the pledge regarding to the b'movable "a" in order to secure the a's credit against b in such case the creation of the pledge shall not take effect by only delivering the movable "a" in way of transfers of possession by instructions
H18-26-1	in cases where person a and person b co-own building x at a ratio of 1 1 if person a dies and had no heirs or persons with special connection ownership of building x belongs to person b
H22-9-I	if two or more movables with different owners are so joined to each other that they can no longer be separated without damaging the same ownership of the composite thing shall vest in the owner of the principal movables
H26-13-E	if a holder of a right of retention leased the thing retained unless he she obtains the consent of the obligor the obligor may demand that the right of retention be extinguished
H24-12-2	in cases where a have created the superficy for b and c over a's land and registered such fact even if the superficy is in quasi co-ownership by b and c the supecify shall be extinguished if b acquires the ownership of a's land
H25-8-1	in the case where a person concluded the sales contract with a minor and bought his her movable after that such contract was rescinded on the grounds of the limited capacity to act even if the person is in good faith and faultless with respect to the fact that the seller is a minor the person may not acquire the ownership of such movavle on the grounds of the immediate acquisition
H23-12-A	the contents of performance that can be refused based on rights of retention are the delivery of the thing but the contents of performance that can be refused based on rights of defense of simultaneous performance are not limited to the delivery of the thing
H20-12-2	since a pledge differs from a right of retention as a right to contracted collateral if there is a contract then a pledge may be established by a person acting as an agent allowing the pledgor to possess the collateral
H24-15-1	if there is a default with respect to a claim secured by a mortgage the mortgage shall extend to the fruits of the mortgaged immovable properties derived after the default
H23-13-A	in cases of pledges over nominative claims if there is an instrument for the claim the pledge establishment does not take effect unless the instrument is delivered
H19-16-1	a person who uses a mortgaged building based on a lease that may not be asserted against the mortgagee may suspend the vacation of that building to the purchaser for up to 6 months from the time that the purchaser purchased the building in cases where the building was auctioned if he she has been using it prior to the commencement of auction proceedings
H19-11-3	in a case where a bought a registered building owned by b and subsequently that building's ownership preservation registration was made in b's name if b sold the building to c and registered the transfer a may not asset his her acquisition of ownership of that building
H21-7-5	if person b hinders the exercise of ownership for a thing owned by person a using methods other than possession of the thing person a's ability to demand the removal or discontinuance of the disturbance from b based on ownership is limited to when person a incurs serious and considerable irreparable damage due to person b's disturbance
H22-11-1	a pledgee can sub-pledge a thing pledged without the approval of the owner of the thing pledged
H27-12-E	in cases where a pledge is created with respect to the subject matter of the statutory lien for sale of movables the statutory lien for sale of movables shall prevail over the pledge
H26-11-E	if they created by an establishing act their mortgagees which secured the entire amount of periodic payments including interest mortgagees may exercise their mortgages in prior to other obligees in accordance with act of establishment
H23-10-1	by possessing a movable without an owner with the intention to own the possessor acquires ownership of the movable
H25-11-U	a servitude holder must pay for benefit to the owner of the servient land
H25-13-1	a holder of a right of retention may exercise his her rights against the whole of the thing retained until his her claim is satisfied in its entirety
H19-12-4	in cases where a contract that creates a pledge upon a claim that cannot be assigned due to its nature has been made such contract is void regardless of whether the pledgee acted in good or bad faith regarding said non-assignability
H19-12-1	a right of retention a pledge and a mortgage may also be exercised against things including monies that the obligor is to receive as a result of the sale lease or loss of or damage to the subject matter of such collateral rights
H25-14-E	a holder of general statutory liens shall have the rights to have his her own claim satisfied prior to other obligees who has the registration of statutory liens for sales of immovable properties even if the liens are not registered with respect to the relevant immovable property
H19-12-3	the order of priority of a real estate statutory lien a real estate pledge and a mortgage is determined by that of the registration
H19-13-U	in addition to the principal of the secured claim pledges of real estates shall secure periodic payments including interest only for those that have fallen due in the most recent two years
H21-10-1	an owner of one part of neighboring land may demand the cooperation of another owner of the land in installing boundary markers at shared cost and the boundary markers installed as a result of that cooperation shall be presumed to be co-owned by the neighbors
H24-17-1	in cases where there is the special provision between the seller and the buyer that a statutoriy lien may be exercised with respect to the movables that are the subject matter of the same after the obligors have delivered those movables to third-party acquirers the statutory lien may not be exercised with respect to the movables that are the subject matter of the same after the buyer have delivered those movables to the re-buyer even if the re-buyer has knowledge that special provision
H23-9-2	provisions for immediate acquisition do not apply in cases where the property of an inheritee that possessed another person's movables is succeeded by inheritance
H18-9-3	in cases where real rights do not require requirements of perfection the real rights that formed earlier in time take priority
H25-11-E	a person who acquires statutory superficies need not to pay the rent to the owner of the land
H24-15-4	in cases where a mortgage with respect to a building is exercised if there is a person who has been using the building since prior to the commnecement of auction procedures and posterior to the registration of the mortgage he she shall not be required to deliver that building to the purchaser thereof until six months have elapsed from the time when the purchaser purchased that building at auction without paying consideration with respect to the use of the building
H25-13-3	if monetary claim is the subject matter of a pledged claim the pledgee may collect the entire amount of the such monetary claim notwithstanding the amount of the pledgee's own claim
H24-12-5	in cases where b has the superficy over a 's land and registered such fact and erected a building on a's land to lease to c the supecify shall not be extinguished even if b acquires the ownership of a's land
H27-36-A	a holder of a right of retention may collect fruits derived from the thing retained and appropriate the same to the satisfaction of his her claim prior to other obligees but the fruits must be appropriated to the payment of interest on the claim and any remainder must not be appropriated to the satisfaction of the principal
H18-15-4	even before the principal of the revolving mortgage is fixed the third party that performed secured claims after the arrival of the due date can execute the revolving mortgage in subrogation of the revolving mortgager in order to make the right to obtain reimbursement from the obligor secure
H22-10-O	even if there is an interruption of prescription in favor of one co-owner of dominant land due to factors of the other co-owners such extinctive prescription proceeds
H24-17-4	the mortgage shall extand to the building on the mortgaged land in cases where there is a special provision that the mortgage extends to the building on the mortgage land
H24-17-3	pledgees of immovable proparty may use and receive the profits form the immovable property that is the subject matter of a pledge and a specail provision between pledgee and pledgor may not exclude the right of that
H18-26-5	in cases where person a pays in advance management fees for a building co-owned by person a and person b and person c receives the share from person b person a can demand that person c should pay for person a's payments
H25-16-3	a revolving mortgagee may exercise his her revolving mortgage up to the maximum amount with respect to all fixed payments of principal as well as periodical payments including interest and compensation for damages resulting from failure to perform obligations
H21-29-A	provisions for statutory liens for real property construction are established in the civil code
H26-27-I	in cases where a found a collared dog whose owner is unknown and took care of it for the unknown owner because the dog was injured when a found it a had a veterinarian heal it and paid the fee if the owner subsequently claims for the restoration of the dog a may refuse to deliver the dog until a obtains reimbursement of the fee a paid
H26-12-A	an owner of land may request the use of the neighboring land to the extent necessary for constructing or repairing walls or buildings on or in the vicinity of the boundary provided however that if the neighbor sustained damages the owner must pay compensation for the same
H21-13-E	a pledge creation contract that has immovable properties or movables as its objective shall take effect by delivering the subject matter but this transfer may be either a summary transfer or a transfer of possession by instruction
H26-12-C	if the partition of land creates a parcel of land that has no access to public roads the owner of such parcel of land may pass to the public roads only through the lands owned by others who participated in the partition in such cases it shall not be necessary to pay compensation
H25-8-3	if a person contributes work to the movables of others ownership of the thing so worked up shall vest in the person who is determined pursuant to the provisions in civil code even if the owner and the processor make other agreement which is different from the provisions in civil code such agreement shall not be take effect
H19-16-5	even if the owner of a mortgaged property acquires fruits derived after the default of the secured claim it shall not be a case of unjust enrichment
H26-13-I	a holder of a right of retention may exercise against things including monies that the obligor is to receive as a result of the loss of the subject matter
H27-12-O	in cases where the hand luggage which a hotel guest brought to the hotel is not owned by him her the owner of the hotel may not exercise his her statutory lien with respect to the hand luggage even if he she believed without negligence that it was owned by the hotel guest
H26-36-G	if a holder of a right of retention incurs ordinary necessary expenses with respect to the thing retained he she may have the owner reimburse the same
H25-11-O	if a superficiary fails to pay the rent for two or more consecutive years the landowner may demand the extinction of the superficies
H26-12-E	a landowner may install a roof that discharges rainwater directly onto neighboring land if there are unavoidable reasons provided however if a neighbor suffers damage the landowner must pay compensation for the same
H25-11-A	superficies may not be the subject matter of a mortgage
H21-3-1	a possessor in good faith shall acquire fruits derived from thing in his her possession but a person in possession thing through duress shall be obliged to return fruits and if the fruits have already been consumed he she shall be obliged to reimburse the cost of the fruits
