H26-14-E	if a third party who purchases a mortgaged immovable properties pay the price of the same to the relevant mortgagee at the request of the mortgagee the mortgage shall be extinguished for the benefit of that third party
H26-13-A	the statutory lien cannot be created by agreement between obligee and obligor however the rights of retention may be created by agreement between obligee and obligor
H26-36-E	even if a pledgee of a movable paid ordinary necessary expenses with respect to the thing pledged which he she is in continuous possession ofhe she may not have the owner reimburse the same
H24-12-3	in cases where b has the superficy over a 's land which had already been the subject of the mortgage and registered such fact the supecify shall be extinguished if b acquires the ownership of a's land
H26-11-I	pledgees of immovable property may not use and receive the profits from the immovable property that is the subject matter of a pledge unless he she obtains the consent of the pledgor
H24-16-2	a person who acquires a claim from a revolving mortgagee before the principal is fixed may not exercise the revolving mortgage with respect to such claim
H27-11-E	in cases where dominant land is co-owned by more than one person if there is a interruption of prescription in favor of one co-owner such interruption shall also be effective for the benefit of other co-owners
H23-9-3	if person accepts the transfer of movables owned by the counterparty who is incapable of intention and the person is in good faith and without fault regarding the incapability of intention of the counterparty he or she acquires the ownership of the movable due to immediate acquisition
H19-14-1	if the obligor sold the subject matter of a statutory lien to a third party the holder of the statutory lien for sales of movables may exercise such right against the purchase money claim accrued from the sales
H20-12-5	if a holder of a right of retention has consent of the obligor or if a pledgee has consent of the pledgor then they each may lease any collateral
H20-26-5	a worker has a statutory lien for the general assets of an employer as collateral for the claim to renumeration that he she has
H21-10-2	assuming there is a need to maintain a distance of 50 centimeters or more from the boundary line when building a building after a year lapses from the time when such construction started or if that building has been completed the owner of the adjacent land may not demand changes to the building and may only claim damages
H19-10-I	since rights of retention are real rights that include the right to possess properties holders of rights of retention cannot demand the return of the property retained by way of an action on title based on rights of retention
H24-17-2	even if there is a special provision between pledgee and pledgor that the pledge does not secure the interest the pledge of movables shall secure such interest
H-A175-P0	no real rights can be established other than those prescribed by laws including this code
H-A176-P0	the creation and transfer of real rights shall take effect solely by the manifestations of intention of the relevant parties
H-A177-P0	acquisitions of losses of and changes in real rights concerning immovable properties may not be asserted against third parties unless the same are registered pursuant to the applicable provisions of the real estate registration act law no 123 of 2004 and other laws regarding registration
H-A178-P0	the transfers of real rights concerning movables may not be asserted against third party unless the movables are delivered
H-A179-P0	if any real rights other than ownership and other rights for which those real rights are the object have vested in the same person such other rights shall be extinguished in such cases the provisions of the proviso to the preceding paragraph shall apply mutatis mutandis
H-A179-P1	the provisions of the preceding two paragraphs shall not apply to possessory rights
H-A179-P2	if ownership and other real rights with respect to the same thing have vested in the same person such other real rights shall be extinguished provided however that this shall not apply to cases where that thing is or such other real rights are the object of the rights of a third party
H-A180-P0	possessory rights shall be acquired by holding thing with an intention to do so on one's own behalf
H-A181-P0	possessory rights may be acquired by an agent
H-A182-P0	the transfers of possessory rights shall be effected by the delivery of the thing possessed
H-A182-P1	in cases where a transferee or his her agent actually holds a thing the transfers of possessory rights may be effected by the parties' manifestations of intention alone
H-A183-P0	if an agent manifests an intention that the thing possessed by it shall thenceforward be possessed on behalf of its principal the principal shall thereby acquire possessory rights
H-A184-P0	in cases where a thing is in an agent's possession if the principal orders that agent to thenceforward possess that thing on behalf of a third party and such third party consents thereto that third party shall acquire possessory rights
H-A185-P0	in cases where it is assumed due to the nature of the title that a possessor does not have the intention to own the nature of the possessor's possession shall not change unless that possessor manifests to the person who made him her possess the thing that he she has the intention of ownership or commences possession under a new title with an intention to own from that time
H-A186-P0	if there is evidence of possession at two different points in time it shall be presumed that possession continued during the interval
H-A186-P1	it shall be presumed that a possessor possesses thing with the intention to own in good faith peacefully and in public
H-A187-P0	a successor to a possessor may at the option of the successor assert either his her possession only or his her possession together with that of the predecessor
H-A187-P1	in cases where a person asserts the possession of the predecessor together with his her own he she shall also succeed to defects in the same
H-A188-P0	it shall be presumed that a possessor lawfully has the rights that a possessor exercises with respect to thing in his her possession
H-A189-P0	if a possessor in good faith is defeated in an action on the title he she shall be deemed to be a possessor in bad faith as from the time when such action was brought
H-A189-P1	a possessor in good faith shall acquire fruits derived from thing in his her possession
H-A190-P0	the provisions of the preceding paragraph shall apply mutatis mutandis to persons who possess thing through violence or duress or by concealing the same
H-A190-P1	a possessor in bad faith shall be obligated to return fruits and reimburse the price of fruits that he she has already consumed has damaged due to negligence or has failed to collect
H-A191-P0	if possessed thing has suffered loss or damage due to reasons attributable to the possessor a possessor in bad faith shall be liable to compensate the person recovering the loss for the entire loss and a possessor in good faith shall be liable to compensate such person for the loss to the extent he she is actually enriched as a result of such loss or damage provided however that a possessor who does not have the intention of holding as owner must compensate the entire loss even if he she is in good faith
H-A192-P0	a person who commences the possession of movables peacefully and openly by a transactional act acquires rights to exercise with respect to such movables immediately if he she is in good faith and faultless
H-A193-P0	in the cases provided for in the preceding article if the possessed thing is lost or stolen goods the victim or person who lost the thing may demand the recovery of that thing from the possessor within two years from the time of the loss or theft
H-A194-P0	if a possessor purchased lost or stolen goods in good faith at an auction or in a public market or from a merchant who sells similar things the victim or person who lost the thing may not recover the thing unless he she reimburses the possessor for the price paid
H-A195-P0	a person who possesses a non-domestic animal bred by others acquires rights to exercise with respect to that animal if he she was in good faith at the beginning of the possession and if recovery is not demanded by the owner of the animal within one month of the time when that animal left the possession of its owner
H-A196-P0	in cases where a possessor returns thing in his her possession he she may have the person recovering the thing reimburse necessary expenses including amounts paid to preserve that thing provided however that if the possessor has acquired fruits ordinary necessary expenses shall be borne by the possessor
H-A196-P1	with respect to beneficial expenses including amounts paid by a possessor to improve thing in his her possession limited to cases where there is a current increase in value the possessor may at the election of the person recovering the thing have the person recovering the thing reimburse monies the possessor paid or the amount of the increased value provided however that with regard to a possessor in bad faith the court may at the request of the person recovering the thing grant a reasonable period for same
H-A197-P0	a possessor may bring a possessory action in accordance with the provisions of the following article through article 202 the same shall apply to a person who takes possession on behalf of others
H-A198-P0	when a possessor is disturbed in his her possession he she may claim for the discontinuation of the disturbance and compensation for damages by bringing an action for maintenance of possession
H-A199-P0	when a possessor is likely to be disturbed of his her possession he she may claim either for the prevention of the disturbance or for the submission of security for the compensation for damages by bringing an action for preservation of possession
H-A200-P0	when a possessor is forcibly dispossessed he she may claim for the restoration of the thing and compensation for damages by bringing an action for recovery of possession
H-A200-P1	an action for recovery of possession cannot be filed against a specific successor of the usurper of possession provided however that this shall not apply if that successor had knowledge of the fact of usurpation
H-A201-P0	actions for recovery of possession must be brought within one year of the time when possession was unlawfully usurped
H-A201-P1	actions for preservation of possession may be brought so long as the danger of disturbance exists in such cases the proviso to the preceding paragraph shall apply mutatis mutandis if possessed thing is likely to be damaged by construction
H-A201-P2	actions for maintenance of possession must be brought during the disturbance or within one year after the disturbance is extinguished provided however that in cases where possessed thing is damaged due to construction if one year has elapsed from the time when that construction started or if that construction has been completed such action cannot be brought
H-A202-P0	with respect to possessory actions no judgment may be made based on reasons relating to title
H-A202-P1	possessory actions do not preclude actions on title and actions on title do not preclude possessory actions
H-A203-P0	possessory rights shall be extinguished when the possessor renounces his her intention to possess or loses possession of the possessed thing provided however that this shall not apply if the possessor brings an action for recovery of possession
H-A204-P0	in cases where a person possesses a thing through an agent possessory rights shall be extinguished on the grounds listed below i that the principal renounces his her intention to have his her agent possess ii that the agent manifests his her intention to the principal to thenceforward possess the possessed thing on behalf of himself herself or a third party or iii that the agent has lost the direct control over the possessed thing
H-A204-P1	possessory rights shall not be extinguished solely as a result of the extinction of the power of representation
H-A205-P0	the provisions of this chapter shall apply mutatis mutandis to cases where a person exercises his her property rights with an intention to do so on his her own behalf
H-A206-P0	an owner has the rights to freely use obtain profit from and dispose of the thing owned subject to the restrictions prescribed by laws and regulations
H-A207-P0	ownership in land shall extend to above and below the surface of the land subject to the restrictions prescribed by laws and regulations
H-A208-P0	deleted
H-A209-P0	an owner of land may request the use of the neighboring land to the extent necessary for constructing or repairing walls or buildings on or in the vicinity of the boundary provided however that he she may not enter the dwelling house of the neighbor without the approval of the same
H-A209-P1	in the cases provided for in the preceding paragraph if the neighbor sustained damages he she may claim compensation
H-A210-P0	an owner of land that is surrounded by other land and has no access to public roads may pass through the other land that surrounds his her land to reach the public roads
H-A210-P1	the preceding paragraph shall likewise apply in cases where an owner cannot access the public roads unless he she passes through ponds lakes rivers waterways or seas or in cases where there is a considerable difference in height between the land and the public road on account of a cliff
H-A211-P0	in the cases provided for in the preceding article the location and method of passage must be so chosen as to meet the needs of the person who is entitled to the right of passage under the provisions of that article and cause the least damage to the other land
H-A211-P1	a person who holds the right of passage under the provisions of the preceding article may construct a road if necessary
H-A212-P0	a person who is entitled to the right of passage pursuant to the provisions of article 210 must pay compensation for damage caused to the other land that he she passes through provided however that except for damage arising from the construction of a road compensation may be paid on an annual basis
H-A213-P0	if the partition of land creates a parcel of land that has no access to public roads the owner of such parcel of land may pass to the public roads only through the lands owned by others who participated in the partition in such cases it shall not be necessary to pay compensation
H-A213-P1	the provisions of the preceding paragraph shall apply mutatis mutandis to cases where the owner of land assigns part of his her land to others
H-A214-P0	a landowner may not interfere with a natural water stream flowing from neighboring land
H-A215-P0	if a stream is blocked at low-lying ground due to a natural disaster or other unavoidable event an owner of higher ground may carry out construction work necessary to remove the barrier to the stream at his her own expense
H-A216-P0	if land suffers or is likely to suffer damage due to destruction or blockage of a structure installed on other land to store discharge or draw water the owner of that land may have the owners of such other lands repair the structure or remove the barriers or if necessary have the same carry out preventive construction work
H-A217-P0	in the cases provided for in the preceding two articles if there are other customs with respect to the allocation of expenses those customs shall prevail
H-A218-P0	a landowner may not install any structure including a roof that discharges rainwater directly onto neighboring land
H-A219-P0	if the land on both sides of a stream is owned by the owner of the land containing the stream that owner may change the course or the width of the same provided however that he she must return the stream to its natural course at the point where the stream meets neighboring land
H-A219-P1	if there are customs that differ from the provisions of the preceding two paragraphs those customs shall prevail
H-A219-P2	an owner of land containing a stream including a channel or moat may not change the course or width of the same if the land on the other side is owned by others
H-A220-P0	an owner of a higher ground may run water through lower grounds to dry out his her higher ground in cases where that land is flooded or to discharge surplus water for household or agricultural or industrial use until the water meets a public stream or sewage system in such cases the location and method that cause the least damage to the lower ground must be selected
H-A221-P0	a landowner may use structures established by owners of higher ground or lower ground in order to cause water from his her land to pass through the same
H-A221-P1	in the cases provided for in the preceding paragraph the person who uses the structures of others must bear the expenses of the establishment and preservation of the structures in proportion to the benefit he she enjoys
H-A222-P0	if the owner of land containing a stream needs to construct a dam he she may construct that dam by fixing it to the other side even if the land on the other side is owned by others provided however that he she must pay compensation for damages arising as a result
H-A222-P1	the provisions of paragraph 2 of the preceding article shall apply mutatis mutandis to the cases provided for in the preceding paragraph
H-A222-P2	the owner of the land on the other side may use the dam under the preceding paragraph if he she owns part of the land containing the stream
H-A223-P0	a landowner may install boundary markers sharing the expenses with the owner of the neighboring land
H-A224-P0	the expenses of installation and preservation of boundary markers shall be borne equally by neighbors provided however that measuring expenses shall be borne in proportion to the sizes of the relevant land parcels
H-A225-P0	if no agreement can be reached between the parties the fence under the preceding paragraph must be wooden fencing bamboo fencing or fencing made of similar material and must be two meters high
H-A225-P1	if two buildings are owned by different owners and there is an open lot between them each owner may install a fence on the boundary sharing the expenses with the other owner
H-A226-P0	the expenses of installation and preservation of the fences under the preceding article shall be borne equally by the neighbors
H-A227-P0	one of neighboring owners may install a fence using materials better than those provided for in paragraph 2 of article 225 or elevating the height provided for under the same paragraph provided however that he she must bear the increase in expenses arising as a result of the same
H-A228-P0	if there are customs that differ from the provisions of the preceding three articles those customs shall prevail
H-A229-P0	boundary markers fences walls channels and moats installed on boundary lines shall be presumed to be co-owned by the neighbors
H-A230-P0	the provisions of the preceding article shall not apply to a wall on a boundary line that forms a part of a building
H-A230-P1	if the height of a wall that separates two neighboring buildings of different heights is higher than the height of the lower building the preceding paragraph shall likewise apply with respect to such portion of that wall that is higher than the lower building provided however that this shall not apply to fire walls
H-A231-P0	if the height of a wall is raised under the provisions of the preceding paragraph the raised portion shall be owned solely by the person who carried out the construction work
H-A231-P1	one of neighboring owners may raise the height of a co-owned wall provided however that if the wall cannot withstand the construction work he she must reinforce that wall as necessary or rebuild the same
H-A232-P0	in the cases provided for in the preceding article if a neighbor suffers damage he she may demand compensation for the same
H-A233-P0	if a tree or bamboo branch from neighboring land crosses a boundary line the landowner may have the owner of that tree or bamboo sever that branch
H-A233-P1	if a tree or bamboo root from neighboring land crosses a boundary line the owner of the land may sever that root
H-A234-P0	in order to construct a building the building must be distanced 50 centimeters or more away from the boundary line
H-A234-P1	if a person attempts to construct a building in violation of the provisions of the preceding paragraph the owner of the neighboring land may have construction suspended or changed provided however that if one year has lapsed from the time when such construction started or if that building has been completed the owner may only claim damages
H-A235-P0	a person who installs a window or porch hereinafter in this and the following paragraph including a veranda at a distance of less than one meter from a boundary line allowing the observation of the residential land of others must put up a privacy screen
H-A235-P1	the distance under the preceding paragraph shall be calculated by measuring the length of a straight line from the point on the window or porch closest to the neighboring land to where it reaches the boundary line at a right angle
H-A236-P0	if there are customs that differ from the provisions of the preceding two articles those customs shall prevail
H-A237-P0	in order to bury water pipes or dig a channel or moat the same must be distanced from the boundary line by a measurement equivalent to at least half the depth of the same provided however that the distance is not required to be more than one meter
H-A237-P1	in order to dig a well service water pit sewage pit or compost pit the same must be distanced two or more meters from the boundary line and in order to dig a pond cellar or urine pit the same must be distanced one or more meters from the boundary line
H-A238-P0	when construction under the preceding article is to be carried out near a boundary line necessary care must be taken to ensure the prevention of earth collapses or leakages of water or contaminated liquids
H-A239-P0	ownership of movables without an owner shall be acquired by possessing the same with the intention to own
H-A239-P1	ownership of real estate without an owner shall vest in the national treasury
H-A240-P0	if the owner of lost property is not identified within three months of the time when public notice thereof is effected as prescribed by the lost property act law no 73 of 2006 the person who found the lost property shall acquire ownership in the same
H-A241-P0	if the owner of hidden treasure is not identified within six months of the time when public notice thereof is effected as prescribed by the lost property act the finder shall acquire ownership in the same provided however that with respect to hidden treasure discovered in a thing belonging to other person the finder and such other person shall acquire equally proportionate ownership in the same
H-A242-P0	the owner of real estate shall acquire ownership in a thing that has been attached thereto as its accessory provided however that the rights of the other person who attached such thing by virtue of his her title shall not be precluded
H-A243-P0	if two or more movables with different owners are so joined to each other that they can no longer be separated without damaging the same ownership of the composite thing shall vest in the owner of the principal movables the same shall apply if excessive expense would be required to separate the same
H-A244-P0	if the distinction of principal and accessory cannot be made between the joined movables the owner of each movable shall co-own the composite thing in proportion to the respective price current at the time of the accession
H-A245-P0	the provisions of the preceding two articles shall apply mutatis mutandis to cases where the things of different owners are mixed together and can no longer be distinguished
H-A246-P0	if a person hereinafter in this article referred to as "processor" contributes work to the movables of others ownership of the thing so worked up shall vest in the owner of the materials provided however that if the value derived from the work significantly exceeds the value of the materials the processor shall acquire ownership in the processed thing
H-A246-P1	in the cases provided for in the preceding paragraph if the processor supplies a portion of the materials the processor shall acquire ownership in the processed thing limited to if the value of such supplied materials plus the value derived from the work exceeds the value of the materials of others
H-A247-P0	in the cases provided for in the preceding paragraph if the owner of a thing has become the sole owner of the thing formed by accession mixture or processing hereinafter in this paragraph referred to as "composite thing" other rights in existence in relation to such thing shall thereafter exist in relation to the composite thing and if the owner of the thing becomes a co-owner of the composite thing other rights in existence in relation to such thing shall thereafter exist in relation to his her share in the same
H-A247-P1	if the ownership of a thing is extinguished in accordance with the provisions of article 242 through the preceding article other rights in existence in relation to such thing shall also be extinguished
H-A248-P0	a person who suffers loss because of the application of the provisions of article 242 through the preceding article may demand compensation in accordance with the provisions of article 703 and article 704
H-A249-P0	each co-owner may use the entire property in co-ownership in proportion to his her share
H-A250-P0	each co-owner's share shall be presumed to be equal
H-A251-P0	no co-owner may make any alteration to the property in co-ownership without the consent of the other co-owners
