H21-5-4	assuming a contract is void due to a mistake after the person making the manifestation ratifies it knowing that such act is void the contract shall become effective retroactively to the time of the act
H19-7-2	extended parts of the building shall be regarded as appurtenance
H18-9-2	statutory real rights granted by way of security exist but statutory usufructuary rights do not exist
H27-36-O	in cases the obligor delays the payment of interest corresponding to one year or more and if the obligor does not pay such interest notwithstanding the demand by the obligee the obligee may incorporate such interest into the principal
H27-36-E	in cases where a seller canceled the contract for sale based on the failure to perform the obligation after he she received the purchase money in part if the money which the seller received as the purchase money in part are to be refunded interest must accrue from the time of the receipt of that money
H26-1-I	the ruling of commencement of assistance at the request of any person other than the person in question shall require the consent of the person in question
H24-12-5	in cases where b has the superficy over a 's land and registered such fact and erected a building on a's land to lease to c the supecify shall not be extinguished even if b acquires the ownership of a's land
H19-11-3	in a case where a bought a registered building owned by b and subsequently that building's ownership preservation registration was made in b's name if b sold the building to c and registered the transfer a may not asset his her acquisition of ownership of that building
H26-36-C	even in cases where a possesor paid ordinary necessary expenses with respect to thing in his her possessionhe she may not have the person recovering the thing reimburse them if the possessor has acquired fruits
H19-6-O	even while the holder of a right to retention continues the possession of the retained property extinctive prescription runs for its secured claim
H22-14-O	if the subject of the claim is to be identified by way of choice among two performances if one of the performances becomes impossible in the future not due to fault of persons involved that do not possess the right to choose then the subject of the claim is identified as the other performance
H22-17-4	if the mandatary suffer any loss due to the administration of the mandated business s without negligence in the mandatary he she can claimcompensation for the loss from the mandator
H18-1-1	a special provision that releases warranty can be made but in that situation when there are rights that the seller establishes on his her own for a third party the seller is not released of warranty
H20-26-2	a contract for work is a contract for value and when there is a need to transfer the subject matter the renumeration must be paid simultaneously with delivery and when there is no need to deliver a thing it must be paid simultaneously with the completion of work
H24-16-5	a revolving mortgagee after the principal is fixed may exercise his her revolving mortgage up to the maximum amount with respect to all fixed payments of principal as well as perioical payments including interest and compensation for damages resulting from failure to perform obligations that have fallen due in the most recent two years
H18-20-1	in cases where an adult ward receives the gift of a building the adult ward cannot rescindthe relevant gift contract
H19-13-I	statutory liens for employer-employee relationships secure salaries paid regularly but do not secure retirement payments that should be paid when the employee retires
H24-11-1	any claim of a real right based on an ownership is the right derived from the ownership therefore only a claim of real right separated from an ownership may not be assigned but may be extinguished by an extinctive prescription
H25-22-3	in the case where the parties agree on the amount of the liquidated damages with respect to the failure to perform the obligation the court only may increase the amount thereof but may not decrease the amount thereof
H23-2-O	even if it is a contract offer with a determined consent period if the period is before or at the same time as the arrival of the offer it can be revoked
H27-24-1	the borrower shall bear the ordinarily necessary costs of borrowed things the lessee shall not bear the ordinarily necessary costs of leased things
H21-13-A	the statutory lien of a lessor of a building shall exist with movables furnished to that building by the lessee
H18-26-1	in cases where person a and person b co-own building x at a ratio of 1 1 if person a dies and had no heirs or persons with special connection ownership of building x belongs to person b
H27-31-U	if parents agree upon which parent shall have parental authority in relation to a child at the time of divorce they may agree that the other parent shall have parental authority
H26-24-A	if the parties have not specified the timing of the return and the purposes of the using and taking profits the lender may not demand the return of the subject matter of the loan for use unless the lender demands the return specifying a reasonable period
H24-7-E	in cases where a and b have a joint and several obligation which a bears the portion of all the extinctive prescription of a's obligation shall not be nullified even if b acknowledge b's obligation to the obligee therefore b also shall be relieved of the obligation if the extinctive prescription is completed
H19-30-1	even if contrary to the intentions of the principal management of business may be established and in that case the manager may request reimbursement for expenses incurred for the principal solely to the extent such principal actually enriched
H27-23-O	a contract for lease is a consensual contract so that a contract for lease shall be formed by the agreement between the perties on the other hand a contract for loan for consumption is a contract in kind so that even if the perties promises that one of the parties will deliver money or other things and the other party will return by means of things that are the same in kind quality and quantity the agreement shall be void
H25-15-4	in the case where the first mortgage and the second mortgage were created on the same real property of the obligor if the obligor pay the obligation which was secured by the first mortgage the obligor shall obtain the first mortgage by subrogation by performance
H27-19-U	unless any other intention is manifested with respect to the expense of performance such expenses shall be borne equally by both the obligor and the obligee however in cases the relevant obligee caused the expense of performance to increase by relocating his her domicile or taking any other actions such incremental amount shall be borne by the obligee
H19-13-U	in addition to the principal of the secured claim pledges of real estates shall secure periodic payments including interest only for those that have fallen due in the most recent two years
H24-16-2	a person who acquires a claim from a revolving mortgagee before the principal is fixed may not exercise the revolving mortgage with respect to such claim
H25-27-4	the depositor must compensate the depositary for damages that occur due to the defects in the thing deposited provided however that this shall not apply if the depositor did not without negligence know of such defect or the depositary knew of the same
H23-1-5	in cases where a buyer who deceives a seller receives the transfer of ownership of land before the seller rescinds his or her manifestation of intention due to fraud even if someone has accepted the establishment of a mortgage of the land without knowing of the fraud the seller can revoke the manifestation of intention
H20-3-3	a person under curatorship's act of accepting payment for a loan without obtaining the consent of his her curator's is voidable
H24-10-5	in cases where a bought the movable "a" which b had owned and deposited to the depositary if a orders the depositary to thenceforward possess it on behalf of a and such depositary consents thereto a shall acquire the possessory right
H25-11-E	a person who acquires statutory superficies need not to pay the rent to the owner of the land
H20-18-E	when the principal obligation has fallen due a person that made a guarantee after receiving consignment of the principal obligor may exercise the right to obtain reimbursement vis-a-vis the principal obligor even before making his her own payment
H24-29-3	parents of a person who died by a tort may claim compensation for their own mental damages against a wrongdoer
H18-21-3	regarding delay in performance of a claim that occurred due to a commercial transaction when a civil conciliation which states that the obligor will perform in installments is formed the period of prescription for the relevant claim shall be 10 years
H27-36-A	a holder of a right of retention may collect fruits derived from the thing retained and appropriate the same to the satisfaction of his her claim prior to other obligees but the fruits must be appropriated to the payment of interest on the claim and any remainder must not be appropriated to the satisfaction of the principal
H27-36-U	if a person who has become a guarantor without the entrustment of the principal obligor has performed the obligation the principal obligor must pay the statutory interest for the period from the day of that performance
H27-28-A	a person who has taken the life of another must compensate for damages only to heirs of the victim
H26-10-3	a library of a university a has a book "p" and a professor b borrowes the same and uses his her office in the same campus in the case where b left "p" in a train on the way home and f found and possesses the same b may claim for the restoration of "p" by bringing an action for recovery of possession against f
H22-25-3	in cases where the contractor demands the party ordering work to provide remuneration if there is any defect in the subject matter of work performed and the party ordering work demands that the contractor repair the defect the party ordering work can refuse to pay remuneration
H22-26-U	if the mandatary received monies and other things during the course of administrating the mandated bushiness the mandatary must immediately deliver them to the mandator
H19-30-3	unless a manager engages in the management of business in order to allow a principal to escape imminent danger to the principal's person reputation or property the manager must manage the business with due care of a prudent manager
H26-1-G	with respect to any act which requires the consent of the curator if the curator does not give consent in cases where the interest of the person under curatorship is unlikely to be prejudiced the family court may at the request of the person under curatorship give permission in lieu of the consent of the curator
H25-29-I	the contractor may not claim his her remuneration without the specified consent of remuneration amount
H22-22-2	in cases where a gift of the specified thing is made without the donee bearing the responsibility if the donor made the gift without knowing that the subject matter has a defect the donor shall not assume a warranty for the defect
H24-4-U	in cases the validity of a manifestation of intention should be affected by knowing any paricular circumstance whether or not such fact existed shall at the election of the principal be determined with eigther the principal or the agent
H20-23-5	a quasi-loan contract shall not become effective when old obligation as its subject matter does not exist
H26-10-2	a library of a university a has a book "p" and a professor b borrowes the same and uses his her office in the same campus d stole "p" the moment b took his her eyes in addition d sold and delivered "p" to e under false ownership even if "p" is stamped the ownership mark by the library and e thinks that d embezzled "p" b may not claim for the restoration of "p" by bringing an action for recovery of possession against e
H26-27-A	in cases where a found a collared dog whose owner is unknown and took care of it for the unknown owner if a took the dog to his her house and takes care of it he she may not demand remuneration from the owner of the dog
H22-9-O	if the distinction of principal and accessory cannot be made between the joined movables based on a demand by one or several owners of each of the movables the owners shall be determined by court
H24-29-1	a plaintiff shall prove that the opponent has responsibility capacity at the time of the tortious act to claim compensation of damages by a tort of a minor
H26-37-A	a general incorporated association shall have rights and assume duties to the extent of the purpose provided in the applicable articles of incorporation subject to the applicable provisions of the laws and regulations
H18-21-2	when jointly and severally liable guarantor person c acknowledges a claim from person a to person b before the prescription period has elapsed the effect of interruption of prescription also affects main obligor person b
H26-1-E	the family court may order the commencement of curatorship without the consent of the person in question
H26-22-4	if there is any defect in the specific gift the donor shall assume a warranty identical to that borne by the seller
H25-21-O	in the case where there is a guarantor on an obligation and a mortgage is taken out on land x which an obligor owns for the same obligation if the guarantor performed the guarantee obligation after an obligee wavied the mortgage the guarantee may exercise the mortgage as it is not wavied
H19-14-1	if the obligor sold the subject matter of a statutory lien to a third party the holder of the statutory lien for sales of movables may exercise such right against the purchase money claim accrued from the sales
H26-2-A	in cases any third party commits any fraud inducing any person to make a manifestation of intention to the other party such manifestation of intention may be rescinded if the other party knew such fact on the other hand in cases any third party commits any duress inducing any person to make a manifestation of intention to the other party such manifestation of intention may be rescinded even if the other party did not know such fact
H24-10-3	a bought the movable "a" which he she had borrowed and possessed from b in such case a may not asserted against b to aquire the ownership of the movable "a" unless a returns it to b and b delivers again it to a in actual
H26-20-3	in case where the obligor deposits the subject-matter of the performance with an official depository the obligation shall not be extinguished unless the obligee accepts the relevant deposited property
H22-23-A	in cases where a lessee has defrayed necessary expenses with respect to the leased thing in order to preserve the condition appropriate for profit from ordinary use of the subject the lessee can wait for the end of the lease and demand the reimbursement of the same from the lessor
H22-3-A	in cases where a person who has consented to the sale of real property due to duress of a third party and the other party does not know of the duress the person cannot rescind the consent
H25-26-3	even if a mandator died an heir of the mandator may not assert termination of mandate by death of the mandator against a mandatary when the mandatary was not notified of or did not know of the same
H22-9-I	if two or more movables with different owners are so joined to each other that they can no longer be separated without damaging the same ownership of the composite thing shall vest in the owner of the principal movables
H24-4-E	in cases where the principal ratifies the contract concluded by a person without authority of agency the contract shall be effective toward the future from the time of the rarification unless other intention is manifested
H24-17-2	even if there is a special provision between pledgee and pledgor that the pledge does not secure the interest the pledge of movables shall secure such interest
H24-15-1	if there is a default with respect to a claim secured by a mortgage the mortgage shall extend to the fruits of the mortgaged immovable properties derived after the default
H24-15-3	a primary obligor may not make a claim for the extinction of a mortgage however a jointly and severally liable guarantor with respect to the obligation may make that claim
H26-32-I	in case where a 30 years old and b 30 years old are a couple and they adopt e 4 years old who is child between c 42 years old and d 42 years old and they are not a couple c affiliated e and d has parental authority in relation to e in making a ruling of special adoption between the couple a and b and ethe legal relationship between e and his her natural parents c and e shall be extinguished
H22-14-E	if the subject of the claim is to be identified by way of choice among more than one performance the right to make the choice shall vest in the obligor as long as there is no special provision
H22-5-U	in cases where the obligor of monetary debt has the obligation to provide security if the security is not provided the obligor cannot assert the benefit of the time
H24-23-3	when one joint and several obligor c performs his her obligation without giving to the other joint and several obligor a a notice if a may has a claim vis-a-vis the obligee b and may set it off a may refuse the reimbursement from c
H18-15-1	even if procedures for auctions petitioned by a lower rank security interest holder have begun since the first rank -revolving mortgagee has priority over the lower rank security interest holder regarding selection of the timing of the auction the first rank revolving mortgagee can stop the auction procedures without fixing the principal
H18-3-2	the employer is released from his her liability in cases when proof is provided that the employer made proper care regarding the appointment and supervision of the employee
H24-5-4	if an unauthorized argent is unable to obtain the ratification of the principal the counterparty who did not konw and without negligence in not knowing that the agent had no authorigy of agency claim damages against him her
H26-37-C	where a juridical person has assigned a nominative claim for payment of money even if a registration of assignment is made in a claim assignment registration file with regard to the assignment of the claim the assignment of the claim may not be asserted against a third party other than the obligor unless the assignor gives a notice thereof to the obligor or the obligor has acknowledged the same using an instrument bearing a fixed date
H26-20-1	in case where the obligee refuses to accept such performance although a third party who has interest in an obligation tenders the performancehe she may deposit the subject-matter of the performance with an official depository even if it is contrary to the intention of the obligor
H21-20-4	if an obligor has given an acknowledgement without objection to the assignor of a claim even if the claim was satisfied he she may not refuse the performance of the obligation vis-a-vis the assignee but may demand the return of the payment money vis-a-vis the assignor
H25-23-I	in the case where a mortgage extinguished because the object of performance was deposited a person who deposited may not recover the deposited property even before an obligee accepts it
H26-32-E	in case where a 30 years old and b 30 years old are a couple and they adopt e 4 years old who is child between c 42 years old and d 42 years old and they are not a couple c affiliated e and d has parental authority in relation to e even in case where the couple a and b adopt ein order to have parental authority in relation to e the couple a and b shall obtain the permission of the family court
H27-27-I	where no delivery of the subject matter is required the duration of contractor's warranty commences to run from the time of the completion of the work
H24-22-5	if an obligee manifests his her intention to release an obligation to the obligor such obligation shall not be extinguished unless the obligor consents
H26-18-2	in cases where b c and d bears a joint and several obligation of 3 million yen to a and where each of them have the equally proportionate obligations even if b effected the set-off intended to invoke his her monetary claim against a the set-off shall be void vis-a-vis c and d
H20-24-5	when a lessee of a building repaired a leak in the roof at his her own expense that the lessor should repair he she may immediately demand reimbursement of the entire amount of the repair expenses from the lessor
H25-24-E	in cases where an easement that was referred to as being in existence for the benefit of a land that is the subject matter of a sale does not exist the cancellation of the contract must be made within one year from the time when the buyer comes to know the facts
H27-31-I	an adopted child excluding specially adopted child what is called a regular adopted child shall be subject to the parental authority of his her natural parents and adoptive parents
H24-2-1	with respect to contracts concluded by the person with limited capacity if the person with limited capacity and the statutory agent have the right to rescind the counterparty also has
H26-27-E	in cases where a found a collared dog whose owner is unknown and took care of it for the unknown owner a took the dog to his her house and took care of it then the dog pushed down a vase on a shoe cupboard and broke it in this case if a was free from any negligence a may claim compensation for the loss from the owner of the dog
H20-28-A	if a plaintiff files against a person with the legal obligation to supervise a person without capacity to assume liability as a defendant and demands compensation of damages based on the liability of the person with the obligation to supervise a person without capacity to assume liability in civil code article 714 paragraph 1 the defendant may assert that he she did not neglect his her obligation to supervise as an affirmative defense
H23-2-I	in cases where against a demand of whether or not to ratify an act of a person with limited capacity a statutory agent issues notification of refusal to ratify within the specified period and it arrives after the lapse of the period it is deemed as having been ratified
H24-27-A	if the contract for work terminates during performance due to reasons not attributable to the contractor he she may demand remuneration in proportion to the performance already completed
H26-31-C	in the case where parents divorce before the birth of a child the family court shall derermine which parent shall at the request of the father or the mother have parent authority
H20-30-I	in the case of concealment of true intention assuming the other party was unaware of the true intention of the party making the manifestation and there was no gross negligence regarding that lack of knowledge that manifestation of intention shall be valid
H26-12-C	if the partition of land creates a parcel of land that has no access to public roads the owner of such parcel of land may pass to the public roads only through the lands owned by others who participated in the partition in such cases it shall not be necessary to pay compensation
H25-14-A	a holder of statutory lien for the sales of the immovable property who has registration of such statutory lien may exercise statutory lien prior to mortgages regardless of the chronological order of the registraiton
H19-13-A	a holder of a right of retention may retain that thing until his her claim is satisfied in its entirety
H20-19-O	a person other than the obligor may not do performance deposit
H24-20-A	no contract for revolving guarantee on loans shall be effective unless it is made in writing
H27-23-A	in the cases where a lessor is the owner of the subject matter in a contract for lease the ownership of the subject matter shall not be transfered to the lessee on the other hand in the cases where a lender is the owner of the subject matter in a contract for loan for consumption the ownership of the subject matter shall be transfered to the borrower
H26-25-5	the borrower may return borrowed things ealier than the time specified in the contract however that may not prejudice the interestof the lender
H25-22-1	regardless of whether there is other agreement the amount of the damages of non-performance shall be determined with reference to monetary value
H26-14-E	if a third party who purchases a mortgaged immovable properties pay the price of the same to the relevant mortgagee at the request of the mortgagee the mortgage shall be extinguished for the benefit of that third party
H18-20-2	in cases when the adult ward performs juristic acts other than acts related to everyday life even if the adult ward obtains approval from the guardian of the adult in advance for the relevant juristic act the adult ward can rescindthe juristic act
H26-14-G	if twenty years has elapsed from the time when it becomes possible to execute the mortgage a mortgagor may assert the extinction of the mortgage by prescription
H27-12-E	in cases where a pledge is created with respect to the subject matter of the statutory lien for sale of movables the statutory lien for sale of movables shall prevail over the pledge
H26-31-E	if there are multiple guardians of a minor in principle they shall exercise their authority jointly but the family court may determine ex officio that some of the guardians should only exercise their authority regarding property individually
H24-5-3	a contract concluded by a person without any authority of agency may not be rescined by the counterparty who knew that the agent had no authority of agency at the time of the conclusion of the contract even before the principal ratifies it
H22-5-I	a time limit can be added to the manifestation of intention of offset but conditions cannot be added
